รหัสโรงเรียน,ชื่อโรงเรียน,เลขประจำตัวประชาชน,ชั้น,ห้อง,เลขประจำตัวนักเรียน,เพศ,คำนำหน้าชื่อ,ชื่อ,นามสกุล,วันเกิด,อายุ(ปี),น้ำหนัก,ส่วนสูง,กลุ่มเลือด,ศาสนา,เชื้อชาติ,สัญชาติ,บ้านเลขที่,หมู่,ถนน/ซอย,ตำบล,อำเภอ,จังหวัด,ชื่อผู้ปกครอง,นามสกุลผู้ปกครอง,อาชีพของผู้ปกครอง,ความเกี่ยวข้องของผู้ปกครองกับนักเรียน,ชื่อบิดา,นามสกุลบิดา,อาชีพของบิดา,ชื่อมารดา,นามสกุลมารดา,อาชีพของมารดา,ความด้อยโอกาส,ยังไม่สามารถจำหน่ายได้ (3.1.8),เป็นลูกเสือ/เนตรนาร,เป็นยุวกาชาด,ทักษะการว่ายน้ำ
36022006,ภูเขียว,1368400145149,ม.2,5,39086,ญ,เด็กหญิง,เกวลิน,เฝ้าทรัพย์,20/03/2555,13,45,155,B,พุทธ,ไทย,ไทย,307,1,-,กวางโจน,ภูเขียว,ชัยภูมิ,มนฤดี,เฝ้าทรัพย์,รับจ้าง,มารดา,ศิริชัย,เฝ้าทรัพย์,รับจ้าง,มนฤดี,เฝ้าทรัพย์,รับจ้าง,เด็กยากจน,-,ลูกเสือ/เนตรนารี,ไม่เป็นสมาชิกยุวกาชาด,True
36022006,ภูเขียว,1234567890123,ม.1,3,39087,ช,เด็กชาย,สมชาย,ใจดี,15/07/2556,12,40,150,A,พุทธ,ไทย,ไทย,125,2,ซอยสุขใจ,บ้านใหม่,ภูเขียว,ชัยภูมิ,สมหญิง,ใจดี,ค้าขาย,มารดา,สมศักดิ์,ใจดี,เกษตรกร,สมหญิง,ใจดี,ค้าขาย,-,-,ลูกเสือ/เนตรนารี,เป็นสมาชิกยุวกาชาด,False
36022007,วิทยาลัยเทคนิค,9876543210987,ม.3,1,39088,ญ,เด็กหญิง,สุภาพร,งามดี,10/12/2554,14,50,160,O,พุทธ,ไทย,ไทย,89,3,ถนนใหญ่,ศรีสุข,เมือง,ชัยภูมิ,นางสาว วิไล,งามดี,ข้าราชการ,มารดา,นายสมพงษ์,งามดี,ข้าราชการ,นางสาว วิไล,งามดี,ข้าราชการ,-,-,เหล่าอากาศ,เป็นสมาชิกยุวกาชาด,True
36022008,โรงเรียนชุมชน,5555666677778,ป.6,2,39089,ช,เด็กชาย,วีระชัย,กล้าหาญ,05/09/2558,10,35,140,AB,พุทธ,ไทย,ไทย,456,4,-,นาดี,บำเหน็จณรงค์,ชัยภูมิ,สมปอง,กล้าหาญ,เกษตรกร,บิดา,สมปอง,กล้าหาญ,เกษตรกร,มาลี,กล้าหาญ,แม่บ้าน,เด็กด้อยโอกาส,-,ไม่เป็นลูกเสือ/เนตรนารี,ไม่เป็นสมาชิกยุวกาชาด,False
36022009,โรงเรียนเอกชน,1111222233334,ม.4,4,39090,ญ,เด็กหญิง,อรุณี,สว่างใส,28/01/2553,15,55,165,-,คริสต์,ไทย,ไทย,234,5,ซอยร่มเย็น,ตลาดใหม่,เมือง,ชัยภูมิ,ดร.สุรชัย,สว่างใส,แพทย์,บิดา,ดร.สุรชัย,สว่างใส,แพทย์,ผศ.อรพิน,สว่างใส,อาจารย์,-,-,เหล่าสมุทร,เป็นสมาชิกยุวกาชาด,True
